Sheet: Feuille1
A1: Colonne 1 | B1: Colonne 2 | C1: Colonne 3 | D1: Colonne 4 | E1: Colonne 5 | F1: Colonne 6 | G1: Colonne 7 | H1: Colonne 8
A2: Ligne 2 | B2: of:=RAND() -> 0.450352265406852 | C2: of:=RAND() -> 0.573991891115392 | D2: of:=RAND() -> 0.246917516462628 | E2: of:=RAND() -> 0.819105645016361 | F2: of:=RAND() -> 0.644487035321704 | G2: of:=RAND() -> 0.856201307433961 | H2: of:=RAND() -> 0.216721638638157
A3: Ligne 3 | B3: of:=RAND() -> 0.700270333193207 | C3: of:=RAND() -> 0.704174366176604 | D3: of:=RAND() -> 0.100031545190199 | E3: of:=RAND() -> 0.422899560993569 | F3: of:=RAND() -> 0.376848581818198 | G3: of:=RAND() -> 0.0647926458399522 | H3: of:=RAND() -> 0.630999480676713
A4: Ligne 4 | B4: of:=RAND() -> 0.799550056746926 | C4: of:=RAND() -> 0.602724898105429 | D4: of:=RAND() -> 0.026010397899474 | E4: of:=RAND() -> 0.839211502640219 | F4: of:=RAND() -> 0.91395438864216 | G4: of:=RAND() -> 0.864427132136848 | H4: of:=RAND() -> 0.107251913980519
A5: Ligne 5 | B5: of:=RAND() -> 0.836269913704706 | C5: of:=RAND() -> 0.947843936781385 | D5: of:=RAND() -> 0.27652239670884 | E5: of:=RAND() -> 0.581037036475127 | F5: of:=RAND() -> 0.691378835045999 | G5: of:=RAND() -> 0.586145655699407 | H5: of:=RAND() -> 0.662272175056097
A6: Ligne 6 | B6: of:=RAND() -> 0.667421043605372 | C6: of:=RAND() -> 0.802666452243506 | D6: of:=RAND() -> 0.818903555371339 | E6: of:=RAND() -> 0.566267288239349 | F6: of:=RAND() -> 0.279312825129009 | G6: of:=RAND() -> 0.639402132090198 | H6: of:=RAND() -> 0.124516323490836
A7: Ligne 7 | B7: of:=RAND() -> 0.545297600995534 | C7: of:=RAND() -> 0.282951355426533 | D7: of:=RAND() -> 0.407031292909454 | E7: of:=RAND() -> 0.861649069197342 | F7: of:=RAND() -> 0.879179091036 | G7: of:=RAND() -> 0.226105070366124 | H7: of:=RAND() -> 0.339896248319971
A8: Ligne 8 | B8: of:=RAND() -> 0.640331474607331 | C8: of:=RAND() -> 0.264926491913838 | D8: of:=RAND() -> 0.857295618893996 | E8: of:=RAND() -> 0.934599633847439 | F8: of:=RAND() -> 0.210276589762989 | G8: of:=RAND() -> 0.568744445229765 | H8: of:=RAND() -> 0.69267460034248
A9: Ligne 9 | B9: of:=RAND() -> 0.452319913928402 | C9: of:=RAND() -> 0.303953076116176 | D9: of:=RAND() -> 0.228163518525346 | E9: of:=RAND() -> 0.861810173599129 | F9: of:=RAND() -> 0.968017431367082 | G9: of:=RAND() -> 0.581667342918524 | H9: of:=RAND() -> 0.724064895821267
A10: Ligne 10 | B10: of:=RAND() -> 0.396376934500759 | C10: of:=RAND() -> 0.149167171944588 | D10: of:=RAND() -> 0.567813462941761 | E10: of:=RAND() -> 0.601686127730029 | F10: of:=RAND() -> 0.22773224765492 | G10: of:=RAND() -> 0.337246309693936 | H10: of:=RAND() -> 0.558481714044583
A11: Ligne 11 | B11: of:=RAND() -> 0.186391893647404 | C11: of:=RAND() -> 0.476595431725391 | D11: of:=RAND() -> 0.416023041727371 | E11: of:=RAND() -> 0.652876980747997 | F11: of:=RAND() -> 0.728182730455015 | G11: of:=RAND() -> 0.408691126513525 | H11: of:=RAND() -> 0.424992861415662
A12: Ligne 12 | B12: of:=RAND() -> 0.154394299967588 | C12: of:=RAND() -> 0.878906425666722 | D12: of:=RAND() -> 0.86411999703971 | E12: of:=RAND() -> 0.32247114451022 | F12: of:=RAND() -> 0.317510286774147 | G12: of:=RAND() -> 0.194004243522164 | H12: of:=RAND() -> 0.500061241474287